{
  "schema": "changerail.review-cycle-history.v1",
  "updated_at": "2026-08-09T00:10:00Z",
  "card": {
    "id": "example-card",
    "path": "openspec/board/3.inprogress/example-card.md"
  },
  "workspace": {
    "root": "/opt/changerail",
    "head_commit": "example-head"
  },
  "cycles": [
    {
      "review_cycle": 1,
      "same_card_rescue_attempt": 0,
      "result": "no-go",
      "reviewed_at": "2026-08-09T00:10:00Z",
      "verdict_path": ".runtime/changerail/reviews/example-card.json",
      "findings": {
        "blocker": 2,
        "major": 0,
        "minor": 0
      },
      "finding_details": [
        {
          "id": "R1",
          "severity": "blocker",
          "summary": "First finding summary stays in the source record.",
          "detail": "First finding detail stays in the source record.",
          "paths": [
            "scripts/changerail_maintenance.py"
          ]
        },
        {
          "id": "R2",
          "severity": "blocker",
          "summary": "Second finding summary stays in the source record.",
          "detail": "Second finding detail stays in the source record.",
          "paths": [
            "scripts/changerail_maintenance.py"
          ]
        }
      ],
      "acceptance": {
        "pass": 0,
        "fail": 2,
        "unverifiable": 0,
        "not_applicable": 0
      }
    }
  ]
}
