{
  "schema": "changerail.review-cycle-history.v1",
  "updated_at": "2026-08-09T00:00:00Z",
  "card": {
    "id": "example-card",
    "path": "openspec/board/3.inprogress/example-card.md"
  },
  "workspace": {
    "root": "/opt/changerail",
    "head_commit": "example-head"
  },
  "cycles": [
    {
      "review_cycle": 1,
      "same_card_rescue_attempt": 0,
      "result": "no-go",
      "reviewed_at": "2026-08-09T00:00:00Z",
      "verdict_path": ".runtime/changerail/reviews/example-card.json",
      "findings": {
        "blocker": 1,
        "major": 0,
        "minor": 0
      },
      "finding_details": [
        {
          "id": "R1",
          "severity": "blocker",
          "summary": "Review prose must stay in the source record.",
          "detail": "Detailed review prose must not be copied into feedback output.",
          "paths": [
            "scripts/changerail_maintenance.py",
            "scripts/changerail_repository_knowledge.py"
          ]
        }
      ],
      "acceptance": {
        "pass": 1,
        "fail": 1,
        "unverifiable": 0,
        "not_applicable": 0
      }
    }
  ]
}
